{
  "timestamp": "2026-10-04T00:00:00Z",
  "metricKey": "host.cpu.usage.user",
  "value": "0.125",
  "unit": "1",
  "metricType": "GAUGE",
  "dimensions": {
    "mode": "user"
  },
  "mappingPin": {
    "id": "zabbix-cpu-user",
    "revision": 1,
    "digest": "sha256:99a6d3d6b549bd47da048352fd902f2eb4a3ca54a4c6c8824be20bef33877247"
  }
}
